{
  "rule_pack_schema_version": "0.1.0",
  "pack_id": "domain-software",
  "version": "0.1.0",
  "layer": "domain",
  "title": "Domain pack: software and product development",
  "description": "Rules scaled to the size and risk of the task -- a one-file script does not need an enterprise release process. See PRD Phase 15.",
  "provenance": { "source": "groundspec built-in", "license": "MIT" },
  "imports": [],
  "rules": [
    {
      "id": "problem-before-solution",
      "version": "0.1.0",
      "title": "State the problem before proposing the implementation",
      "purpose": "Prevent building the first plausible solution to an unstated problem.",
      "scope": "Software/product tasks.",
      "applies_when": true,
      "severity": "soft_objective",
      "requirement": "brief.normalized_problem_statement describes what is broken or missing, distinct from brief.goal describing what will be built.",
      "verification_method": "manual_inspection",
      "evidence_requirement": "The two fields are not restatements of each other.",
      "failure_behavior": "downgrade_score",
      "source_or_rationale": "PRD Phase 15: 'Problem definition.'"
    },
    {
      "id": "acceptance-criteria-scaled-to-risk",
      "version": "0.1.0",
      "title": "Acceptance criteria exist and are scaled to risk, not maximal by default",
      "purpose": "Avoid forcing heavyweight process onto small, low-risk tasks while still requiring a real Definition of Done.",
      "scope": "Software/product tasks.",
      "applies_when": true,
      "severity": "hard_constraint",
      "requirement": "acceptance.criteria contains at least one 'must' criterion with a concrete verification_method; for routing.risk_level 'low', criteria may be minimal, but they may not be empty.",
      "verification_method": "manual_inspection",
      "evidence_requirement": "acceptance.criteria is non-empty and each criterion is independently checkable.",
      "failure_behavior": "block_completion",
      "source_or_rationale": "PRD Phase 15: 'Acceptance criteria... Do not force an elaborate enterprise process onto a small script.'"
    },
    {
      "id": "architecture-decisions-recorded-when-consequential",
      "version": "0.1.0",
      "title": "Record non-obvious architecture decisions",
      "purpose": "Preserve the reasoning behind a choice that a future maintainer could not otherwise recover.",
      "scope": "Software tasks with routing.risk_level of 'medium' or higher.",
      "applies_when": { "path": "routing.risk_level", "op": "in", "value": ["medium", "high", "critical"] },
      "severity": "soft_objective",
      "requirement": "Any decision that would surprise a future maintainer (dependency choice, data-model shape, backward-compatibility trade-off) is recorded with its rationale.",
      "verification_method": "manual_inspection",
      "evidence_requirement": "A decision record or equivalent note exists for each such choice.",
      "failure_behavior": "downgrade_score",
      "source_or_rationale": "PRD Phase 15: 'Architecture decisions.'"
    },
    {
      "id": "backward-compatibility-considered",
      "version": "0.1.0",
      "title": "Backward compatibility is considered for changes to existing interfaces",
      "purpose": "Prevent silently breaking existing callers or users.",
      "scope": "Software tasks that modify an existing public interface, schema, or CLI.",
      "applies_when": { "path": "routing.risk_overlays", "op": "contains", "value": "filesystem_mutation" },
      "severity": "soft_objective",
      "requirement": "A change to an existing interface states whether it is backward-compatible and, if not, calls this out as a breaking change rather than leaving it implicit.",
      "verification_method": "manual_inspection",
      "evidence_requirement": "The deliverable or changelog states compatibility impact explicitly.",
      "failure_behavior": "downgrade_score",
      "source_or_rationale": "PRD Phase 15: 'Backward compatibility.'"
    },
    {
      "id": "security-basics-for-user-input",
      "version": "0.1.0",
      "title": "Code handling external input avoids common injection classes",
      "purpose": "Prevent OWASP-Top-10-class vulnerabilities from being introduced.",
      "scope": "Software tasks that produce code handling external input.",
      "applies_when": { "path": "routing.risk_overlays", "op": "contains", "value": "security_sensitive" },
      "severity": "hard_constraint",
      "requirement": "Code that handles external input is checked for injection, XSS, path traversal, and similar OWASP Top 10 classes before being reported complete.",
      "verification_method": "static_analysis",
      "evidence_requirement": "A note or tool output showing this check was performed.",
      "failure_behavior": "block_completion",
      "source_or_rationale": "General safety rules; PRD Phase 13 threat model."
    },
    {
      "id": "tests-scaled-to-risk-and-actually-run",
      "version": "0.1.0",
      "title": "Tests are scaled to risk and actually executed, not just written",
      "purpose": "Prevent claiming correctness based on code that looks right but was never run.",
      "scope": "Software tasks.",
      "applies_when": true,
      "severity": "hard_constraint",
      "requirement": "Any 'tests pass' claim in status.verified_facts must be backed by an actual test-run command and its output, not by static review alone.",
      "verification_method": "reproducible_command",
      "evidence_requirement": "The command and a summary of its output (pass/fail counts) are recorded.",
      "failure_behavior": "block_completion",
      "source_or_rationale": "PRD Phase 19: 'Test meaningful invariants... every skipped test must have a narrow, documented environmental reason.'"
    },
    {
      "id": "release-engineering-scaled-to-risk",
      "version": "0.1.0",
      "title": "Release/packaging steps are scaled to actual distribution risk",
      "purpose": "Avoid demanding CI/CD and package publishing for a throwaway script, while still requiring it for a published package.",
      "scope": "Software tasks whose expected_deliverables include a published package, release, or public repository.",
      "applies_when": { "path": "routing.risk_overlays", "op": "contains", "value": "external_communication" },
      "severity": "soft_objective",
      "requirement": "Packaging, versioning, and release notes are addressed proportionally to whether the deliverable is actually meant to be published or shared.",
      "verification_method": "manual_inspection",
      "evidence_requirement": "The deliverable's distribution plan matches its actual audience.",
      "failure_behavior": "downgrade_score",
      "source_or_rationale": "PRD Phase 15: 'Release engineering... Scale requirements to risk and task size.'"
    },
    {
      "id": "evidence-based-completion",
      "version": "0.1.0",
      "title": "Completion is evidence-based, not assumed from code existing",
      "purpose": "Prevent conflating 'I wrote the code' with 'the feature works'.",
      "scope": "Software tasks.",
      "applies_when": true,
      "severity": "hard_constraint",
      "requirement": "status.completion_status of 'complete' requires each 'must' acceptance criterion to have a corresponding entry in status.verified_facts.",
      "verification_method": "automated_test",
      "evidence_requirement": "A 1:1 mapping exists between must-criteria and verified_facts entries.",
      "failure_behavior": "block_completion",
      "source_or_rationale": "PRD Phase 15: 'Evidence-based completion.'"
    }
  ]
}
