{
  "rule_pack_schema_version": "0.1.0",
  "pack_id": "domain-content",
  "version": "0.1.0",
  "layer": "domain",
  "title": "Domain pack: content and marketing",
  "description": "Rules for content/marketing deliverables. Engagement is never optimized through deception. See PRD Phase 15.",
  "provenance": { "source": "groundspec built-in", "license": "MIT" },
  "imports": [],
  "rules": [
    {
      "id": "audience-objective-channel-defined",
      "version": "0.1.0",
      "title": "Audience, objective, and channel are defined before drafting",
      "purpose": "Prevent writing generic content that fits no specific placement.",
      "scope": "Content/marketing tasks.",
      "applies_when": true,
      "severity": "hard_constraint",
      "requirement": "brief.target_users names the actual audience, and brief.context or scope.constraints names the objective and the publishing channel/platform.",
      "verification_method": "manual_inspection",
      "evidence_requirement": "All three are present and specific, not placeholders.",
      "failure_behavior": "block_completion",
      "source_or_rationale": "PRD Phase 15: 'Audience. Objective. Channel.'"
    },
    {
      "id": "claim-substantiation",
      "version": "0.1.0",
      "title": "Every substantive claim is substantiated",
      "purpose": "Keep marketing claims honest and defensible.",
      "scope": "Content/marketing tasks.",
      "applies_when": true,
      "severity": "hard_constraint",
      "requirement": "Any factual or comparative claim (performance numbers, 'first', 'best', 'only') traces to a source in status.verified_facts.",
      "verification_method": "manual_inspection",
      "evidence_requirement": "Claims without a matching verified fact are flagged as unverified_claims, not asserted.",
      "failure_behavior": "block_completion",
      "source_or_rationale": "PRD Phase 15: 'Claim substantiation.'"
    },
    {
      "id": "prohibited-claims-and-deceptive-tactics",
      "version": "0.1.0",
      "title": "No prohibited claims or deceptive persuasion tactics",
      "purpose": "Keep content honest even when honesty is less persuasive.",
      "scope": "Content/marketing tasks.",
      "applies_when": true,
      "severity": "hard_constraint",
      "requirement": "No fake urgency/scarcity, fabricated testimonial, or claim the brand cannot substantiate appears anywhere in the content.",
      "verification_method": "manual_inspection",
      "evidence_requirement": "A review confirms none of these tactics are present.",
      "failure_behavior": "block_completion",
      "source_or_rationale": "PRD Phase 15: 'Do not optimize engagement through deception, fake urgency, invented testimonials, or unsupported statistics.'"
    },
    {
      "id": "brand-and-format-constraints-respected",
      "version": "0.1.0",
      "title": "Brand voice, prohibited-claims list, and platform format are respected",
      "purpose": "Keep the content usable as-is rather than needing a rewrite to fit the brand or platform.",
      "scope": "Content/marketing tasks.",
      "applies_when": true,
      "severity": "soft_objective",
      "requirement": "Any brand voice guide or platform format constraint supplied in scope.constraints is followed (length limits, tone, required disclosures).",
      "verification_method": "manual_inspection",
      "evidence_requirement": "The draft matches the stated constraints.",
      "failure_behavior": "downgrade_score",
      "source_or_rationale": "PRD Phase 15: 'Voice... Brand constraints... Platform format.'",
      "conflict_key": "platform-format-constraint"
    },
    {
      "id": "call-to-action-present-and-honest",
      "version": "0.1.0",
      "title": "A call to action is present and does not overpromise",
      "purpose": "Give the content a clear next step without misrepresenting what happens next.",
      "scope": "Content/marketing tasks whose objective includes driving an action.",
      "applies_when": { "path": "routing.risk_overlays", "op": "contains", "value": "external_communication" },
      "severity": "soft_objective",
      "requirement": "If the objective is to drive a specific action, the content includes a clear call to action that accurately describes what will happen.",
      "verification_method": "manual_inspection",
      "evidence_requirement": "The CTA matches the actual destination/outcome.",
      "failure_behavior": "downgrade_score",
      "source_or_rationale": "PRD Phase 15: 'Call to action.'"
    },
    {
      "id": "review-and-outcome-measurement-named",
      "version": "0.1.0",
      "title": "A review step and an outcome measurement are named",
      "purpose": "Avoid publishing content with no way to check whether it worked or who approved it.",
      "scope": "Content/marketing tasks.",
      "applies_when": true,
      "severity": "soft_objective",
      "requirement": "acceptance.criteria or control.stop_conditions names who reviews/approves the content, and how its outcome will be measured after publishing.",
      "verification_method": "manual_inspection",
      "evidence_requirement": "Both elements are present in the contract.",
      "failure_behavior": "downgrade_score",
      "source_or_rationale": "PRD Phase 15: 'Review and approval. Outcome measurement.'"
    }
  ]
}
