{
  "rule_pack_schema_version": "0.1.0",
  "pack_id": "core-invariants",
  "version": "0.1.0",
  "layer": "core",
  "title": "Core invariants",
  "description": "Universal requirements that apply to every task regardless of domain or risk level. See PRD Phase 7, Layer 1.",
  "provenance": { "source": "groundspec built-in", "license": "MIT", "maintainer": "groundspec" },
  "imports": [],
  "rules": [
    {
      "id": "preserve-user-intent",
      "version": "0.1.0",
      "title": "Preserve user intent",
      "purpose": "Prevent the executor from substituting its own goal for the user's.",
      "scope": "All tasks.",
      "applies_when": true,
      "severity": "hard_constraint",
      "requirement": "The deliverable must address brief.goal as stated, or explicitly flag and justify any deviation before proceeding.",
      "verification_method": "manual_inspection",
      "evidence_requirement": "A reviewer can trace each deliverable back to brief.goal or an explicitly logged, justified deviation.",
      "failure_behavior": "block_completion",
      "source_or_rationale": "PRD Phase 7, Layer 1: 'Preserve user intent'."
    },
    {
      "id": "separate-facts-from-assumptions",
      "version": "0.1.0",
      "title": "Separate facts from assumptions",
      "purpose": "Prevent silently-assumed context from being reported as if it were given.",
      "scope": "All tasks.",
      "applies_when": true,
      "severity": "hard_constraint",
      "requirement": "Every assumption made about missing information must be recorded in scope.assumptions rather than asserted as fact.",
      "verification_method": "manual_inspection",
      "evidence_requirement": "scope.assumptions lists anything the executor inferred rather than was told.",
      "failure_behavior": "block_completion",
      "source_or_rationale": "PRD Phase 7, Layer 1: 'Separate facts from assumptions'."
    },
    {
      "id": "no-claiming-unperformed-work",
      "version": "0.1.0",
      "title": "Do not claim unperformed work",
      "purpose": "Prevent reporting verification, execution, or research that did not actually happen.",
      "scope": "All tasks.",
      "applies_when": true,
      "severity": "hard_constraint",
      "requirement": "Every entry in status.verified_facts must correspond to something actually executed or inspected, labeled with an honest evidence_label (never a stronger label than the evidence supports).",
      "verification_method": "manual_inspection",
      "evidence_requirement": "Each verified fact cites what was run or read; fabricated citations or invented results are treated as a hard-constraint violation, not a scoring deduction.",
      "failure_behavior": "block_completion",
      "source_or_rationale": "PRD Phase 1 (fabricated sources) and 'Final report' evidence-labeling requirement."
    },
    {
      "id": "respect-authorization",
      "version": "0.1.0",
      "title": "Respect authorization boundaries",
      "purpose": "Prevent inferred or assumed authorization for actions the user never granted.",
      "scope": "All tasks with any risk_overlays beyond 'informational'.",
      "applies_when": { "not": { "path": "routing.risk_overlays", "op": "eq", "value": ["informational"] } },
      "severity": "hard_constraint",
      "requirement": "No action outside routing.authorization.granted_permissions may be taken, and every action in routing.authorization.requires_confirmation_for must be confirmed with the user before execution, regardless of budget pressure.",
      "verification_method": "manual_inspection",
      "evidence_requirement": "A log or transcript entry showing confirmation was obtained before each such action.",
      "failure_behavior": "block_completion",
      "source_or_rationale": "PRD Phase 12/13: authorization boundaries and confused-deputy prevention."
    },
    {
      "id": "protect-secrets-and-private-data",
      "version": "0.1.0",
      "title": "Protect secrets and private data",
      "purpose": "Prevent leaking credentials or personal data into artifacts, logs, or reports.",
      "scope": "All tasks.",
      "applies_when": true,
      "severity": "hard_constraint",
      "requirement": "No secret, credential, API key, or personal data beyond what the task explicitly requires may appear in exported artifacts, logs, or error messages.",
      "verification_method": "automated_test",
      "evidence_requirement": "A secret-scan of produced artifacts reports no matches.",
      "failure_behavior": "block_completion",
      "source_or_rationale": "PRD Phase 13/14: secret leakage threat and privacy requirements."
    },
    {
      "id": "evidence-appropriate-to-claim",
      "version": "0.1.0",
      "title": "Use evidence appropriate to the claim",
      "purpose": "Prevent a strong claim (e.g. 'tests pass') from resting on weak evidence (e.g. 'looks right').",
      "scope": "All tasks.",
      "applies_when": true,
      "severity": "soft_objective",
      "requirement": "Each acceptance criterion's evidence_required must match its verification_method in strength (e.g. automated_test claims are backed by actual command output, not by inspection alone).",
      "verification_method": "manual_inspection",
      "evidence_requirement": "Reviewer confirms the evidence type matches the declared verification method.",
      "failure_behavior": "downgrade_score",
      "source_or_rationale": "PRD Phase 5: evidence_quality dimension; Phase 1: evidence hierarchy."
    },
    {
      "id": "define-completion-before-execution",
      "version": "0.1.0",
      "title": "Define completion before execution",
      "purpose": "Prevent moving goalposts by deciding acceptance criteria only after seeing the result.",
      "scope": "All tasks.",
      "applies_when": true,
      "severity": "hard_constraint",
      "requirement": "acceptance.criteria must be non-empty before execution begins, unless the task is pure open-ended exploration explicitly marked as such in scope.non_goals.",
      "verification_method": "manual_inspection",
      "evidence_requirement": "The contract's acceptance.criteria predates the first execution iteration.",
      "failure_behavior": "block_completion",
      "source_or_rationale": "PRD Phase 4/9: acceptance criteria and Definition of Done grounding."
    },
    {
      "id": "report-limitations-and-uncertainty",
      "version": "0.1.0",
      "title": "Report limitations and uncertainty",
      "purpose": "Prevent a confident-sounding report from hiding what is actually unknown or unverified.",
      "scope": "All tasks.",
      "applies_when": true,
      "severity": "hard_constraint",
      "requirement": "status.remaining_uncertainty and status.residual_risks must be populated whenever completion_status is 'partial', 'blocked', or 'complete' with any unverified_claims present.",
      "verification_method": "manual_inspection",
      "evidence_requirement": "The final report enumerates open uncertainty rather than implying none exists.",
      "failure_behavior": "block_completion",
      "source_or_rationale": "PRD 'Final report' section and Phase 6 budget-expiration reporting."
    },
    {
      "id": "no-silent-skip-on-budget-expiry",
      "version": "0.1.0",
      "title": "Budget expiry may never be reported as full completion",
      "purpose": "Prevent a task that ran out of budget from silently skipping verification and calling itself done.",
      "scope": "All tasks.",
      "applies_when": { "path": "status.budget_expired", "op": "eq", "value": true },
      "severity": "hard_constraint",
      "requirement": "status.completion_status must be 'partial' or 'blocked', never 'complete', and status.omitted_work must describe what was cut.",
      "verification_method": "automated_test",
      "evidence_requirement": "Mechanically checked by groundspec audit/evaluate: see groundspec.budget.model.forbid_silent_skip_on_expiry.",
      "failure_behavior": "block_completion",
      "source_or_rationale": "PRD Phase 6: 'Never skip required verification silently' / 'Return incomplete rather than pretending completion.'"
    }
  ]
}
