{
  "rule_pack_schema_version": "0.1.0",
  "pack_id": "domain-research",
  "version": "0.1.0",
  "layer": "domain",
  "title": "Domain pack: research and evidence synthesis",
  "description": "Rules for evidence-based analysis. Number of sources is explicitly not a quality proxy. See PRD Phase 15.",
  "provenance": { "source": "groundspec built-in", "license": "MIT" },
  "imports": [],
  "rules": [
    {
      "id": "explicit-research-question",
      "version": "0.1.0",
      "title": "The research question is stated explicitly and is answerable",
      "purpose": "Prevent open-ended 'look into this' work from never converging.",
      "scope": "Research tasks.",
      "applies_when": true,
      "severity": "hard_constraint",
      "requirement": "brief.goal states a specific, answerable research question, not a vague topic.",
      "verification_method": "manual_inspection",
      "evidence_requirement": "The question could, in principle, be answered 'yes/no/uncertain, because...'.",
      "failure_behavior": "block_completion",
      "source_or_rationale": "PRD Phase 15: 'Research question.'"
    },
    {
      "id": "primary-over-secondary-sources",
      "version": "0.1.0",
      "title": "Primary sources are preferred over secondary summaries",
      "purpose": "Avoid laundering an unreliable summary as if it were the original evidence.",
      "scope": "Research tasks.",
      "applies_when": true,
      "severity": "soft_objective",
      "requirement": "Where a primary source (official docs, standards, filings, datasets, papers) exists, it is cited in preference to a secondary summary or marketing post.",
      "verification_method": "manual_inspection",
      "evidence_requirement": "Cited sources are checked against a primary/secondary classification.",
      "failure_behavior": "downgrade_score",
      "source_or_rationale": "PRD Phase 1: 'Prefer official product documentation... Avoid treating marketing posts... as authoritative.'"
    },
    {
      "id": "recency-checked",
      "version": "0.1.0",
      "title": "Source recency is checked against the research cutoff date",
      "purpose": "Prevent stale information from being presented as current.",
      "scope": "Research tasks.",
      "applies_when": true,
      "severity": "soft_objective",
      "requirement": "Each source's publication or last-updated date is recorded, and staleness relative to the task's needs is called out.",
      "verification_method": "manual_inspection",
      "evidence_requirement": "Dates are present alongside citations.",
      "failure_behavior": "downgrade_score",
      "source_or_rationale": "PRD Phase 15: 'Recency... Research cutoff date.'"
    },
    {
      "id": "citation-proximity",
      "version": "0.1.0",
      "title": "Claims are cited next to the claim, not only in a bibliography",
      "purpose": "Make it possible to check any single claim without re-deriving the whole source list.",
      "scope": "Research tasks.",
      "applies_when": true,
      "severity": "soft_objective",
      "requirement": "Each non-obvious factual claim carries its source inline or in an immediately adjacent reference, not only in an end-of-document list.",
      "verification_method": "manual_inspection",
      "evidence_requirement": "Spot-checking a claim does not require searching the whole bibliography.",
      "failure_behavior": "downgrade_score",
      "source_or_rationale": "PRD Phase 15: 'Citation proximity.'"
    },
    {
      "id": "contradictory-evidence-surfaced",
      "version": "0.1.0",
      "title": "Contradictory evidence is surfaced, not silently dropped",
      "purpose": "Prevent cherry-picking sources that support a preferred conclusion.",
      "scope": "Research tasks.",
      "applies_when": true,
      "severity": "hard_constraint",
      "requirement": "When credible sources disagree, both positions are reported along with why one is judged more reliable, rather than presenting only the preferred one.",
      "verification_method": "manual_inspection",
      "evidence_requirement": "status.remaining_uncertainty or the deliverable itself names the disagreement.",
      "failure_behavior": "block_completion",
      "source_or_rationale": "PRD Phase 15: 'Contradictory evidence.'"
    },
    {
      "id": "inference-labeled-distinct-from-evidence",
      "version": "0.1.0",
      "title": "Inference is labeled distinctly from directly observed evidence",
      "purpose": "Keep the reader from mistaking the researcher's reasoning for a sourced fact.",
      "scope": "Research tasks.",
      "applies_when": true,
      "severity": "hard_constraint",
      "requirement": "Conclusions drawn by inference (not stated directly by any source) are marked as such, matching the MODEL-EVALUATED or PROPOSED evidence labels rather than VERIFIED.",
      "verification_method": "manual_inspection",
      "evidence_requirement": "status.verified_facts and status.unverified_claims use evidence_label correctly.",
      "failure_behavior": "block_completion",
      "source_or_rationale": "PRD Phase 15: 'Inference labeling.'"
    },
    {
      "id": "quotation-and-copyright-limits",
      "version": "0.1.0",
      "title": "Quotation stays within fair-use-scale limits",
      "purpose": "Avoid reproducing copyrighted material at length.",
      "scope": "Research tasks.",
      "applies_when": true,
      "severity": "hard_constraint",
      "requirement": "Quoted material from any single source stays short (a sentence or two) and attributed; longer material is summarized in the researcher's own words instead.",
      "verification_method": "manual_inspection",
      "evidence_requirement": "No extended verbatim reproduction appears in the deliverable.",
      "failure_behavior": "block_completion",
      "source_or_rationale": "PRD Phase 15: 'Quotation and copyright limits.'"
    },
    {
      "id": "uncertainty-and-reproducibility-recorded",
      "version": "0.1.0",
      "title": "Uncertainty and the search protocol are recorded for reproducibility",
      "purpose": "Let another researcher understand what was and was not covered, and redo the search.",
      "scope": "Research tasks.",
      "applies_when": true,
      "severity": "soft_objective",
      "requirement": "The report states its search strategy (queries/sources tried), what it could not resolve, and the cutoff date of its own knowledge plus the access date of any live sources.",
      "verification_method": "manual_inspection",
      "evidence_requirement": "These elements are present in the report, not only implied.",
      "failure_behavior": "downgrade_score",
      "source_or_rationale": "PRD Phase 15: 'Uncertainty... Reproducibility... Research cutoff date.'"
    }
  ]
}
